{
  "formatVersion": "1.0",
  "source": {
    "url": "https://folio-org.atlassian.net/wiki/spaces/TC/pages/5053681/Officially+Supported+Technologies",
    "title": "Officially Supported Technologies",
    "documentStatus": "ACCEPTED",
    "exportDate": "2026-07-14",
    "reviewDate": "2026-01-26",
    "supportPeriod": {
      "endDate": "2027-06-30",
      "statement": "The source page identifies this date as the end of the applicable technology support period."
    },
    "notes": [
      "The source export contains stray Sunflower wording that does not change the current policy entries.",
      "Historical flower context is retained only in quoted source statements and never participates in evaluation."
    ]
  },
  "definitions": {
    "oneOfSpecifiedVersions": "When versions are provided, a module must use, work with, or support at least one specified version.",
    "allOfSpecifiedVersions": "When versions are provided, a module must work with all specified versions.",
    "unspecifiedVersions": "Use the latest supported version where possible; entry-specific guidance may be provided."
  },
  "sections": [
    {
      "id": "frontend-languages",
      "area": "frontend",
      "category": "language",
      "consumer": "s007",
      "versionPolicy": "one-of-specified-versions",
      "entries": [
        { "id": "javascript", "displayName": "JavaScript", "aliases": ["js"], "ecosystem": "javascript", "technologyType": "language", "sourceStatement": "JavaScript", "strength": "normative" },
        { "id": "typescript", "displayName": "TypeScript", "aliases": ["ts"], "ecosystem": "javascript", "technologyType": "language", "sourceStatement": "TypeScript", "strength": "normative" }
      ]
    },
    {
      "id": "frontend-build-tools",
      "area": "frontend",
      "category": "build-tool",
      "consumer": "s012",
      "versionPolicy": "one-of-specified-versions",
      "entries": [
        { "id": "node", "displayName": "Node.js", "aliases": ["nodejs"], "ecosystem": "javascript", "technologyType": "build-tool", "sourceStatement": "Node 22", "strength": "normative", "constraint": { "kind": "major-line", "expression": "22" } },
        { "id": "yarn", "displayName": "Yarn", "aliases": [], "ecosystem": "javascript", "technologyType": "build-tool", "sourceStatement": "Yarn 1", "strength": "normative", "constraint": { "kind": "major-line", "expression": "1" } },
        { "id": "github-actions", "displayName": "GitHub Actions", "aliases": [], "ecosystem": "agnostic", "technologyType": "build-tool", "sourceStatement": "GitHub Actions", "strength": "normative" },
        { "id": "jenkins", "displayName": "Jenkins", "aliases": [], "ecosystem": "agnostic", "technologyType": "build-tool", "sourceStatement": "Jenkins for legacy projects", "strength": "normative", "applicability": ["legacy-projects"] }
      ]
    },
    {
      "id": "frontend-first-party-frameworks",
      "area": "frontend",
      "category": "framework",
      "consumer": "s007",
      "versionPolicy": "one-of-specified-versions",
      "entries": [
        { "id": "stripes", "displayName": "Stripes", "aliases": ["@folio/stripes"], "ecosystem": "javascript", "technologyType": "framework", "sourceStatement": "Stripes 10.1 or greater", "strength": "normative", "constraint": { "kind": "minimum", "expression": "10.1.0" } }
      ]
    },
    {
      "id": "frontend-third-party-frameworks",
      "area": "frontend",
      "category": "framework",
      "consumer": "s007",
      "versionPolicy": "one-of-specified-versions",
      "entries": [
        { "id": "react", "displayName": "React", "aliases": ["react-dom"], "ecosystem": "javascript", "technologyType": "framework", "sourceStatement": "React ^18.2.0", "strength": "normative", "constraint": { "kind": "range", "expression": "^18.2.0" } }
      ]
    },
    {
      "id": "frontend-build-testing",
      "area": "frontend",
      "category": "testing",
      "consumer": "s013",
      "versionPolicy": "unspecified-versions",
      "entries": [
        { "id": "jest", "displayName": "Jest", "aliases": [], "ecosystem": "javascript", "technologyType": "testing", "sourceStatement": "Jest should be 29 or greater", "strength": "advisory", "constraint": { "kind": "minimum", "expression": "29.0.0" }, "recommendations": ["Use Jest 29 or greater."] },
        { "id": "react-testing-library", "displayName": "React Testing Library", "aliases": ["@testing-library/react", "rtl"], "ecosystem": "javascript", "technologyType": "testing", "sourceStatement": "RTL should be 14 or greater", "strength": "advisory", "constraint": { "kind": "minimum", "expression": "14.0.0" }, "recommendations": ["Use React Testing Library 14 or greater."] }
      ]
    },
    {
      "id": "frontend-integration-testing",
      "area": "frontend",
      "category": "testing",
      "consumer": "s013",
      "versionPolicy": "provisional",
      "sourceStatement": "Pending verification",
      "entries": [
        { "id": "cypress", "displayName": "Cypress", "aliases": [], "ecosystem": "javascript", "technologyType": "testing", "sourceStatement": "Cypress 12.0, pending verification", "strength": "provisional", "constraint": { "kind": "minimum", "expression": "12.0.0" }, "provisional": true, "notes": ["Pending verification."] }
      ]
    },
    {
      "id": "backend-languages",
      "area": "backend",
      "category": "language",
      "consumer": "s007",
      "versionPolicy": "one-of-specified-versions",
      "entries": [
        { "id": "java", "displayName": "Java", "aliases": ["jdk"], "ecosystem": "java", "technologyType": "language", "sourceStatement": "Java/JDK 21; Grails modules use at least Java 17", "strength": "normative", "constraint": { "kind": "major-line", "expression": "21" }, "exceptions": [{ "appliesTo": "grails-modules", "constraint": { "kind": "minimum", "expression": "17.0.0" }, "strength": "normative", "sourceStatement": "Grails modules use at least Java 17" }] },
        { "id": "groovy", "displayName": "Groovy", "aliases": [], "ecosystem": "java", "technologyType": "language", "sourceStatement": "Groovy version determined by Grails", "strength": "normative", "applicability": ["grails-modules"], "notes": ["Version compliance follows the applicable Grails rule."] },
        { "id": "openapi", "displayName": "OpenAPI", "aliases": ["oas"], "ecosystem": "openapi", "technologyType": "language", "sourceStatement": "OpenAPI 3", "strength": "normative", "constraint": { "kind": "major-line", "expression": "3" } },
        { "id": "go", "displayName": "Go", "aliases": ["golang"], "ecosystem": "go", "technologyType": "language", "sourceStatement": "Go 1.25 or greater", "strength": "normative", "constraint": { "kind": "minimum", "expression": "1.25.0" } }
      ]
    },
    {
      "id": "backend-build-tools",
      "area": "backend",
      "category": "build-tool",
      "consumer": "s012",
      "versionPolicy": "unspecified-versions",
      "entries": [
        { "id": "maven", "displayName": "Maven", "aliases": ["mvn"], "ecosystem": "java", "technologyType": "build-tool", "sourceStatement": "Maven 3.8 or later", "strength": "normative", "constraint": { "kind": "minimum", "expression": "3.8.0" } },
        { "id": "docker", "displayName": "Docker", "aliases": [], "ecosystem": "agnostic", "technologyType": "build-tool", "sourceStatement": "Docker", "strength": "advisory" },
        { "id": "gradle", "displayName": "Gradle", "aliases": [], "ecosystem": "java", "technologyType": "build-tool", "sourceStatement": "Gradle guidance is unresolved", "strength": "provisional", "provisional": true, "notes": ["No definitive version guidance is supplied."] },
        { "id": "make", "displayName": "Make", "aliases": ["gnu-make"], "ecosystem": "go", "technologyType": "build-tool", "sourceStatement": "Make guidance is unresolved", "strength": "provisional", "provisional": true, "notes": ["No definitive version guidance is supplied."] }
      ]
    },
    {
      "id": "backend-first-party-frameworks",
      "area": "backend",
      "category": "framework",
      "consumer": "s007",
      "versionPolicy": "one-of-specified-versions",
      "entries": [
        { "id": "folio-spring-base", "displayName": "folio-spring-base", "aliases": ["org.folio:folio-spring-base"], "ecosystem": "java", "technologyType": "framework", "sourceStatement": "folio-spring-base 8.2 or greater", "strength": "normative", "constraint": { "kind": "minimum", "expression": "8.2.0" } },
        { "id": "folio-vertx-lib", "displayName": "folio-vertx-lib", "aliases": ["org.folio:folio-vertx-lib"], "ecosystem": "java", "technologyType": "framework", "sourceStatement": "folio-vertx-lib 3.3 or greater", "strength": "normative", "constraint": { "kind": "minimum", "expression": "3.3.0" } },
        { "id": "raml-module-builder", "displayName": "raml-module-builder", "aliases": ["org.folio:raml-module-builder"], "ecosystem": "java", "technologyType": "framework", "sourceStatement": "raml-module-builder 35 for existing modules only", "strength": "normative", "constraint": { "kind": "major-line", "expression": "35" }, "applicability": ["existing-modules"], "deprecation": { "deprecated": true, "note": "Deprecated; only existing FOLIO modules may continue to use it." } },
        { "id": "edge-common", "displayName": "edge-common", "aliases": ["org.folio:edge-common"], "ecosystem": "java", "technologyType": "framework", "sourceStatement": "edge-common 4.8.0 or greater", "strength": "normative", "constraint": { "kind": "minimum", "expression": "4.8.0" } },
        { "id": "edge-common-spring", "displayName": "edge-common-spring", "aliases": ["org.folio:edge-common-spring"], "ecosystem": "java", "technologyType": "framework", "sourceStatement": "edge-common-spring 2.4.6 or greater", "strength": "normative", "constraint": { "kind": "minimum", "expression": "2.4.6" } },